irn,EventID,Type,Status,Title,Section,Commenced,Completed,Description,Locality,Organizer,Curator,Designer,ObjectIDs
3526,EX2009.9,Exhibition,Completed,"Preserving a Legacy: Wishard Hospital Murals","Alliance Gallery",2009-01-17,2009-03-29,"In 1914, a group of renowned Hoosier artists painted murals for the benefit of patients at Wishard Memorial Hospital (then known as City Hospital).  The IMA conservation department has been working to bring these murals back to their original condition since 2004, when they conserved a painting by Indiana African American artist William Edouard Scott.  Since then, the conservation of several works by such Indiana artists as T. C. Steele, Clifton Wheeler, J. Ottis Adams, and Wayman Adams has been completed.\\The exhibition will include a cleaned work by T. C. Steele along with before and during treatment photographs, and a Carl Graf painting divided into partially cleaned and fully cleaned surfaces. The conservation project is made possible through the generosity of the Efroymson Foundation.",Internal,"","Harriet Warkel","David Russick",67143 | 67144 | 67145 | 67146 | 67147 | 67148 | 67149 | 67150 | 67151 | 67156 | 67157 | 67158 | 67159 | 67160
3671,EX2009.11,Exhibition,Completed,"Fashion in Bloom","Paul Fashion Arts Gallery",2009-04-04,2010-01-31,"This exhibition, drawn entirely from the IMA's extensive Fashion Arts Collection, brings together 25 examples of fashion that feature flower motifs. For centuries, delicate forms and rich colors of flowers have captivated artists and designers alike. Using roses, poppies, petunias, peonies, chrysanthemums and wildflowers, artists gave life to the simplest of silhouettes. The floral patterns on these garments were executed in a range of techniques including printing, embroidery, beading and brocading. Among the designers whose work will be exhibited are Norman Norell, Bill Blass, Givenchy, Galanos, Trigere and Callot Soeurs. Fashion in Bloom offers an in-depth look at the major styles of Western fashion, by providing a framework of significant shifts in silhouettes of feminine attire from the late 1700s to 1970s.",Internal,"","Niloo Imami-Paydar","Mike Bir",28349 | 6151 | 20319 | 6150 | 58029 | 58030 | 22838 | 18259 | 18260 | 18261 | 13361 | 27665 | 58331 | 58332 | 58333 | 14785 | 33733 | 57820 | 57821 | 13295 | 23129 | 58284 | 58285 | 14334 | 22382 | 58378 | 58379 | 58380 | 64133 | 65476 | 66516 | 66517 | 66534 | 17089 | 58512 | 58513 | 35150 | 51 | 58431 | 58432 | 58433 | 6614 | 11288 | 11289 | 11290 | 5310 | 5311 | 5312 | 
3736,EX2009.13,Exhibition,Completed,"Eighteenth-Century Furniture Design","Conant Gallery",2009-05-23,2010-02-21,"The design of fine furniture involves the dual concerns of functional need and aesthetic choice. It is intimately related to architecture and interior design as well as the fine arts, all of which followed similar stylistic developments in the history of European art. This exhibition will present approximately forty-five prints of French, German, and especially English furniture design as well as more than a dozen related pieces of furniture that illustrate the major stylistic development of the eighteenth century-one of the most significant periods of European decorative arts.",Internal,"","Todd Magreta","Mike Bir",24100 | 28242 | 58807 | 9430 | 34860 | 17377 | 5947 | 3055 | 20939 | 14524 | 3950 | 11836 | 11835 | 17789 | 7643 | 9260 | 9276 | 9278 | 9282 | 9076 | 9078 | 2697 | 9080 | 9082 | 9083 | 2502 | 45998 | 45999 | 46000 | 46001 | 46002 | 46003 | 46004 | 46006 | 46007 | 1204 | 44884 | 44885 | 9318 | 46008 | 46009 | 46010 | 46012 | 46014 | 46015 | 46016 | 46017 | 46018 | 11389 | 46060 | 46061 | 46063 | 46065 | 18660 | 
3741,EX2009.14,Exhibition,Completed,"Tajima Hiroyuki","Appel Gallery",2009-04-11,2009-10-11,"This rotation is made up of 10 woodblock prints owned by the IMA and created by Tajima Hiroyuki (1911-1984), an important Sosaku hanga (creative print movement) artist. His method includes the use of shellac, torn and crumpled papers, dyes and other materials in conjunction with wood blocks to create low reliefs and complex surface textures. A notable feature of his work is his subtle color harmonies at times combined with strikingly contrasting colors to create a luminescent glow to his works. The works are graphically intriguing and also quite organic in quality. The results are works on paper with great depth and quiet beauty.",Internal,"","John Teramoto","Mike Bir",60943 | 60944 | 60945 | 60947 | 60948 | 60950 | 60951 | 60952 | 60957 | 60958 | 60950
3825,EX2009.15,Exhibition,Completed,"Judith G. Levy: Memory Cloud","Efroymson",2009-07-10,2010-01-24,"Judith G. Levy's art deals with themes of memory, exploring the fleeting nature of individual experience, the similarities and differences between collective and personal acts of remembering, and how memories can be explicit or elusive. The installation will be comprised of a monumental *cloud* made from white plastic photo viewers that hang on strands of microfilament. The viewers are designed to be held up to the light to reveal an image inside. Each of the plastic viewers will contain a unique photograph, drawn from a collection of thousands of found 35mm slides that the artist has collected over the years throughout the Midwest. These photographs capture people posing for family snapshots, attending holiday events, working, enjoying vacations, or simply observing the world around them. In some areas, these viewers will be hung out of reach - suggesting a metaphor for experiences or memories that can not be retrieved - while in other areas they will be hung at a height that is accessible to visitors so that they can have the personal experience of peering through the viewers at these familiar yet mysterious images.\\Levy is an artist based in Kansas, who until recently lived and worked in Indianapolis. Her work incorporates a variety of mediums, including drawing, sculpture, video and performance.  Levy's installation in the Efroymson Family Pavilion will be her first major solo museum exhibition, and will feature a work specially commissioned for the IMA.",Internal,"","Allison Unruh","Matthew Taylor",
3826,EX2009.16,Exhibition,Completed,"Omer Fast: The Casting","Forefront Gallery",2009-09-11,2010-02-21,"Presented for the first time at the IMA since its acquisition in 2008, Omer Fast's landmark work, The Casting, is a fourteen-minute, four-channel video installation. Fast edited the video from conversations he recorded in Texas in 2006 with a young U.S. Army sergeant preparing to depart for his second tour in Iraq. The sergeant recounts two stories, which Fast splices and interweaves, blending the narrator's recollections of a date with a German woman while stationed in Bavaria, and the accidental shooting of a civilian in Iraq. The multi-layered account alternates between the two stories, with brief interruptions by a third narrative element of a film director asking questions of an actor at a casting. From one side of the room, the two screens display the sergeant speaking to Fast in the original interview, while from the opposite side the screens silently depict actors performing the same script.",Internal,"","Sarah Green","David Russick",66104 | 67400 | 67401 | 67402 | 67403 | 67102 | 
3827,EX2009.17,Exhibition,Completed,"Paired Photographs","Golden Gallery",2009-07-18,2010-03-21,"While photographers have been chronicling the visible world for 159 years, their varying approaches to similar subjects underscore the creativity and flexibility of the medium of photography. This notion will manifest itself by the pairing of twenty sets of European and American photographs selected from the permanent collection. The themes of architecture, landscape, portraiture, the figure, war, protest, abstraction and the passing crowd will be explored through the pairings of Carleton Watkins and Ansel Adams, Edward Weston and Harry Callahan, Peter Henry Emerson and Lois Conner, Lewis Hine and Lisette Model, Walker Evans and Berenice Abbott, Alfred Stieglitz and W. Eugene Smith, Minor White and Dorothea Lange, and Robert Doisneau and Weegee.",Internal,"","Marty Krause","Mike Bir",60319 | 17201 | 67098 | 60724 | 65113 | 26930 | 60720 | 60397 | 60729 | 60726 | 734 | 23260 | 57213 | 8793 | 8218 | 12730 | 46676 | 14172 | 27847 | 16938 | 64864 | 33332 | 65112 | 61772 | 3347 | 57946 | 9045 | 66440 | 12554 | 53000 | 7412 | 60719 | 62798 | 30173 | 57945 | 60846 | 13262 | 9641 | 13441 | 60717 | 603 | 36353 | 
3829,EX2009.19,Exhibition,Completed,"Smuggling Daydreams into Reality: Yesterday, Today and Forever","Star Studio",2009-08-08,2010-01-18,"*Smuggling Daydreams into Reality: Yesterday, Today and Tomorrow* presents short films produced by area high school students over the course of their participation in the IMA's Museum Apprentice Program.  The students were mentored by acclaimed film director Julie Dash, who worked with the students over a period of seven months as the students created a series of films exploring the concept of dreams deferred and dreams realized.  The exhibition will also feature a new film by Julie Dash that chronicles the students' creative process throughout the apprenticeship.",Internal,"","Phil Lynam","Phil Lynam",
3546,EX2009.20,Exhibition,Completed,"Josephine Meckseper: Recent Films","Video Gallery",2009-10-16,2010-02-07,"New York-based artist Josephine Meckseper is widely acclaimed for her thought-provoking works executed in a range of media that engage with questions about the role of consumerism and political engagement in contemporary society.\\The videos in this exhibition, 0% Down (2008) and Mall of America (2009), crystallize many of the core issues that Meckseper has explored through her works in other media, using imagery appropriated from advertising and documentary footage of a shopping mall to create aesthetically seductive yet challenging works. Alternately displayed on opposite walls of the video gallery, this pair of works is visually stimulating in the contrasting visual strategies represented - one work filmed black-and-white with intense sound, the other drenched in vivid colors with a haunting ambient soundtrack - and presents a dynamic dialogue about the connections between politics and consumerism in contemporary life.",Internal,"","Allison Unruh","David Russick",67791 | 67841
3870,EX2009.21,Exhibition,Completed,"The Thirty-Six Views of Mt. Fuji","Appel Gallery",2009-10-17,2010-02-07,"Rising majestically with a near-perfect cone shape, Mount Fuji has been a favorite subject of Japanese artists from the earliest times. Mount Fuji was a daily presence in the lives of the citizens of the shogun's capital of Edo, and it was also visible from many portions of the eastern portion of the great Tokaido Highway that linked Edo with the ancient capital of Kyoto. \\This exhibition features 18 of the prints that make up Utagawa Hiroshige's Thirty-Six Views of Mt. Fuji. The series was completed just before his death and published the following year.",Internal,"","John Teramoto","",35567 | 22121 | 18215 | 4064 | 11228 | 1874 | 25667 | 14048 | 15333 | 35074 | 35075 | 31480 | 2253 | 24426 | 7403 | 11380 | 24971 | 35276 | 22363 | 854 | 85445 | 
3864,EX2009.22,Exhibition,Completed,"The Viewing Project: Wondering About Space","Alliance Gallery",2009-12-21,2010-06-20,"*The Viewing Project* is a three-year series of small-scale installations designed to offer visitors creative and enjoyable experiences with objects from the IMA's permanent collection. Although themes vary, the main goals of all Viewing Project installations remain constant: to encourage active looking, to support visitor creativity and engagement, and to present objects from the permanent collection in new ways. Funded in part by a generous grant from ART MENTOR FOUNDATION LUCERNE and support from Wayne Zink.",Internal,"","Annette Schlagenhauff","David Russick",14108 | 61621 | 25173 | 26277 | 11596 | 14990 | 8073 | 60825 | 60826 | 65681 | 54089 | 12731 | 3972 | 19400 | 25233 | 356 | 7063 | 29008
3836,EX2009.23,Exhibition,Completed,"The Viewing Project: Wondering about Detail","Alliance Gallery",2009-05-16,2009-11-22,"Installation of 8 IMA artworks (2 paintings, 4 objects, 2 textiles, and 1 print) for The Viewing Project.",Internal,"","Annette Schlagenhauff","",65402 | 65047 | 35973 | 21624 | 8848 | 27318 | 18197 | 
5538,EX2009.24,Exhibition,Completed,"Black Expo: Silhouette (working title)","",2009-07-09,2009-07-19,"",Internal,"","","",
3549,EX2010.4,Exhibition,Completed,"*TRAVELING* European Design Since 1985: Shaping the New Century","High Museum of Art",2010-06-05,2010-08-29,"",Internal,"","R. Craig Miller","David Russick",
3369,EX2010.5,Exhibition,Completed,"Tara Donovan: Untitled","AWC",2010-04-04,2010-08-01,"This exhibition will highlight MacArthur genius award-winner Tara Donovan's layered landscape-like installations made from common everyday materials, such as plastic cups, tar paper, fishing line, pencils, and Elmer's glue. The exhibition will include five existing works and three new sculptures commissioned by the IMA, along with a selection of Donovan's drawings from the past ten years.",Internal,"","Dr. Lisa Freiman","David Russick",68742 | 68826 | 68796 | 68797 | 68792 | 68795 | 68788 | 68789 | 68790 | 68791 | 68746 | 68794 | 68793 | 68737 | 68738 | 68739 | 68740 | 68741 | 68743 | 68744 | 94527
3828,EX2010.6,Exhibition,Completed,"Joshua Mosley: American International","Video Gallery",2010-03-12,2010-08-29,"This exhibition brings together two video and sculpture installations by Philadelphia-based artist Joshua Mosley: *A Vue* (2004) and the museum premiere of his newest work *International.* Each work is composed of a video that uses computer and stop-motion animation, and bronze sculptures of the figures that populate the works. Combining the most current technology with the hand-wrought physicality of studio-made objects,* A Vue* and *International* employ video and sculpture in a critically engaged manner that poses nuanced questions about American ideology and contemporary life.\\*Joshua Mosley: American International* will be presented in the Carmen & Mark Holeman Video Gallery and adjacent gallery space (W388, W385A).",Internal,"","Sarah Green","Mike Bir",68434 | 68435 | 68436 | 68437 | 68438 | 68439 | 69512 | 94527
3527,EX2010.7,Exhibition,Completed,"Indiana Artists' Club Annual Exhibition","North Hall Gallery",2010-04-17,2010-05-30,"The Indiana Artists' Club, Inc. was organized as the Indiana Art Club in 1917 by a group of 46 artists and patrons including such notables as T. C. Steele, William Forsyth, Otto Stark, Carl Graf, Wayman Adams, Simon Baus, Marie Goth, Frederick Polley, Clifton Wheeler, Randolph Coats, Carl Lieber and Alex Holiday.\This will be the Club's 78th Annual Juried Exhibition.",Internal,"","Marty Krause","Mike Bir",
3733,EX2010.8,Exhibition,Completed,"Jeppe Hein","Forefront Gallery",2010-05-07,2010-09-05,"*Jeppe Hein* is a site-specific installation that consists of a kinetic indoor rollercoaster track for a series of white, plastic balls. When a visitor enters the space, a sensor reacts and releases a ball that is set in motion and runs the length of the track, passing loops and sharp curves within the circuit. In conjunction with this installation, Hein is developing a new outdoor experiential artwork, *Bench Around the Lake,* on the Museum grounds for the inaugural exhibition in 100 Acres: the Virginia B. Fairbanks Art & Nature Park. Conceived as an exhibition in two parts, both installations will provoke dynamic relationships between visitor and artwork, offering contrasting experiences of shared indoor and outdoor space through artworks that only activate with audience interaction.",Internal,"","Sarah Green","Mike Bir",68836
3847,EX2010.9,Exhibition,Completed,"Framed","Forefront Gallery",2010-11-05,2011-03-06,"Taking Bruce Nauman's *Dance or Exercise on the Perimeter of a Square* (1967-68) and Richard Serra's *Frame* (1969) as points of departure, this exhibition brings together for the first time recent video work that documents artists' bodily confrontation with the frame of the camera and boundaries delimited within. Through a variety of movements, procedures, and performances, the artists in *Framed* investigate the space between self and environment, self and other, and the divide between what is recorded by a camera and the indefinite expanse of unmediated life. Each video depicts the artist as he or she marks, follows, or grapples with a boundary and thereby maps the space of a now-expanded studio, still encompassing the familiar territory of four-walled artist's studio, but also stretching into the street, city, and wider surroundings. \\*Framed* features Serra and Nauman's seminal films along with recent works by Kate Gilmore, Sigalit Landau, Lilly McElroy, Robin Rhode, Melanie Schiff, and Type A. The exhibition will be presented in the McCormack Forefront Galleries as well as the Holeman Video Gallery.",Internal,"","Dr. Lisa Freiman","David Russick",68830 | 68833 | 68834 | 68835 | 68837 | 71263 | 71247 | 71200 | 68839 | 68840 | 71283 | 68838 | 
3861,EX2010.10,Exhibition,Completed,"Ball-Nogues Studio: Gravity's Loom","Efroymson",2010-09-03,2011-03-20,"Los Angeles-based design team Ball-Nogues Studio will create an immersive, site-specific installation of multicolored strings configured in catenary curves for the IMA's Efroymson Family Entrance Pavilion. Trained as architects, Benjamin Ball and Gaston Nogues are working with the pavilion's architecture to develop an installation related to the function of the space as a thoroughfare and meeting point for visitors. The studio's practice fuses the disciplines of art, architecture, and design, bringing aspects of each world to the others to create technologically innovative and visually spectacular built environments.",Internal,"","Petra Slinkard","Brad Dilger",69284
3863,EX2010.11,Exhibition,Completed,"Andy Warhol Enterprises","AWC",2010-10-10,2011-01-02,"Andy Warhol Enterprises will be the first major museum exhibition to comprehensively examine Andy Warhol's lifelong investigation of the themes of commerce, consumerism, reproducibility and the business of art making. To help manage his highly successful career as a commercial illustrator, Warhol formed Andy Warhol Enterprises, Inc. in 1957. The aesthetic approach, techniques and business acumen he developed during that time informed his artistic production from the early 1960s until his death in 1987. Throughout his career as an artist, filmmaker, *Factory* director, band manager, magazine publisher and television entrepreneur, Warhol intentionally blurred the line between art and commerce, slyly calling into question the very values of art itself in such statements as *Good business is the best art.*\ \The exhibition will examine works from each of the major decades of Warhol's artistic career, from his commercial illustrations and shop window designs of the 1950s, to his groundbreaking paintings and sculptures of consumer products and stars of the 1960s, to his commissioned portraiture and entrepreneurial ventures into various media, such as magazines, film and TV, in the 1970s and 1980s.",Internal,"","Sarah Green","David Russick",70225 | 70815 | 70816 | 70817 | 70818 | 70811 | 70812 | 70813 | 70814 | 70828 | 70829 | 70830 | 70652 | 70879 | 70880 | 70881 | 70803 | 70804 | 70805 | 70806 | 70849 | 70850 | 70851 | 70721 | 70722 | 70723 | 70724 | 70725 | 70726 | 70727 | 70728 | 70729 | 70730 | 70731 | 70732 | 70733 | 70735 | 70736 | 70737 | 70738 | 70739 | 70783 | 70784 | 70785 | 70786 | 70787 | 70788 | 70789 | 70790 | 70791 | 70792 | 70793 | 70794 | 70795 | 70796 | 70740 | 70741 | 70742 | 70743 | 70744 | 70745 | 70746 | 70747 | 70748 | 70749 | 70750 | 70751 | 70752 | 70753 | 70754 | 70758 | 70831 | 70832 | 70833 | 70843 | 70844 | 70845 | 70840 | 70841 | 70842 | 70846 | 70847 | 70848 | 70685 | 70686 | 70687 | 70688 | 70689 | 70690 | 70691 | 70692 | 70693 | 70694 | 70695 | 70696 | 70697 | 70855 | 70856 | 70857 | 70657 | 70658 | 70659 | 70660 | 70834 | 70835 | 70836 | 70669 | 70670 | 70671 | 70672 | 70824 | 70825 | 70826 | 70827 | 70797 | 70798 | 70799 | 70800 | 70801 | 70698 | 70699 | 70700 | 70701 | 70702 | 70703 | 70704 | 70705 | 70706 | 70707 | 70708 | 70709 | 70710 | 70711 | 70712 | 70713 | 70714 | 70715 | 70716 | 70717 | 70718 | 70719 | 70720 | 70734 | 70755 | 70756 | 70757 | 70759 | 70760 | 70761 | 70762 | 70763 | 70764 | 70765 | 70766 | 70767 | 70768 | 70769 | 70837 | 70838 | 70839 | 70819 | 70820 | 70822 | 70823 | 70861 | 70862 | 70863 | 70858 | 70859 | 70860 | 70653 | 70654 | 70655 | 70656 | 70876 | 70877 | 70878 | 70661 | 70662 | 70663 | 70664 | 70807 | 70808 | 70809 | 70810 | 70677 | 70678 | 70679 | 70821 | 70665 | 70666 | 70667 | 70668 | 70673 | 70674 | 70675 | 70676 | 70870 | 70871 | 70872 | 70867 | 70868 | 70869 | 70680 | 70681 | 70682 | 70882 | 70883 | 70884 | 70852 | 70853 | 70854 | 70864 | 70865 | 70866 | 70873 | 70874 | 70875 | 70770 | 70771 | 70772 | 70773 | 70774 | 70775 | 70776 | 70777 | 70778 | 70779 | 70780 | 70781 | 70782 | 70683 | 70684 | 70802 | 70646 | 70647 | 70648 | 70649 | 70650 | 70651 | 70885 | 71354 | 71358 | 71357 | 71356 | 71353 | 94527
3871,EX2010.12,Exhibition,Completed,"Heather Rowe: Tenuous Arrangements","Efroymson",2010-02-19,2010-08-01,"New York-based artist Heather Rowe employs architectural fragments to create complex abstract compositions that engage the space around them in surprising and often poetic ways. For the IMA's Efroymson Family Entrance Pavilion, Rowe will create a site-specific installation that employs fragments of architectural materials such as wood, sheetrock and metal frames to create a self-supporting structure that appears as a succession of cascading frames, suggesting an unfolding screen. Slices of found interior furnishings, such as chairs, mirror frames, fireplace mantels and wallpaper, will be incorporated into the structure. Planters filled with grasses that echo the plantings visible through the glass windows will anchor the piece and relate it to the exterior. Like Rowe's past work, the installation will provoke viewers to move about and engage in the complex space the sculpture creates.",Internal,"","Allison Unruh","David Russick",68816 | 69368 | 69369 | 94527
3872,EX2010.13,Exhibition,Completed,"Body Unbound: Contemporary Couture from the IMA's Collection","Paul Textile Gallery",2010-04-10,2011-01-30,"This exhibition examines the varied approaches designers use to present, manipulate and transform the female body. Approximately 25 pieces by avant-garde fashion designers such as Gernreich, Gaultier, Mugler, Versace, Miyake, and Moschino, dating from the 1960s to 2007, will be featured. The exhibition will take place in the Paul Fashion Arts Gallery as well as the Paul Textiles Gallery.",Internal,"","Niloo Imami-Paydar","David Russick",68616 | 68331 | 67839 | 64973 | 65092 | 65009 | 68335 | 65028 | 68332 | 65400 | 66540 | 67837 | 68423 | 65052 | 65059 | 67840 | 66537 | 67835 | 66538 | 68334 | 68337 | 68427 | 68425 | 68336 | 66534 | 68339 | 66459 | 66461 | 66467 | 68333 | 66469 | 67561 | 67445 | 66542 | 62483 | 68677 | 66463 | 62484 | 68338 | 67838 | 65399 | 68424 | 
3880,EX2010.14,Exhibition,Completed,"Watercolor Society of Indiana Annual Juried Exhibition","North Hall Gallery",2010-10-16,2010-12-05,"The Watercolor Society of Indiana presents its 28th annual juried exhibition of paintings. The Watercolor Society of Indiana is made up of more than 300 artist, student, and patron members statewide who produce high quality watercolor paintings and seek to educate the public about the beautiful transparent medium.",Internal,"","Angie Day","Mike Bir",
3855,EX2010.15,Exhibition,Completed,"*TRAVELING* European Design Since 1985: Shaping the New Century","Milwaukee Art Museum",2010-10-06,2011-01-09,"",Internal,"","R. Craig Miller","David Russick",
