irn,EventID,Type,Status,Title,Section,Commenced,Completed,Description,Locality,Organizer,Curator,Designer,ObjectIDs
2432,EX1987.10,Exhibition,Completed,"John Shedd: Clay","Long Gallery",1987-03-31,1987-05-03,"",Internal,"","","",
2433,EX1987.11,Exhibition,Completed,"All That Jazz: A New, Upbeat Collection","Alliance Rental Gallery",1987-04-03,1987-04-12,"",Internal,"","","",
2434,EX1987.12,Exhibition,Completed,"Art Smart Indiana","Indianapolis Museum of Art at Columbus, Columbus, Indiana",1987-04-04,1987-05-31,"",Internal,"","","",29270 | 2817 | 37087 | 16502 | 3713 | 25768 | 7587 | 37383 | 23911 | 19350 | 
2435,EX1987.13,Exhibition,Completed,"Riley Illustrated","Beesley Gallery",1987-04-14,1987-06-14,"",Internal,"","","",
2436,EX1987.14,Exhibition,Completed,"Sam Miller: Botswana Crafts","Long Gallery",1987-05-05,1987-05-31,"",Internal,"","","",
2437,EX1987.15,Exhibition,Completed," Indianapolis Remembered: The Drawings of Christian Schrader","AFNB Gallery , Indianapolis",1987-05-08,1987-09-04,"",Internal,"","","",
2438,EX1987.16,Exhibition,Completed,"Bonsai Tree Society Annual Exhibition","Herron Hall",1987-05-16,1987-05-17,"",Internal,"","","",
2439,EX1987.17,Exhibition,Completed,"Steven Maslach: Handblown Glass","Long Gallery",1987-06-02,1987-06-24,"",Internal,"","","",
2440,EX1987.18,Exhibition,Completed,"Postcard Series VII Original Art Work: Arts Insight","Indianapolis Museum of Art at Columbus, Columbus, Indiana",1987-06-06,1987-07-27,"",Internal,"","","",
2441,EX1987.19,Exhibition,Completed,"Raquel's Collection: South American Crafts","Long Gallery",1987-06-26,1987-07-30,"",Internal,"","","",
2442,EX1987.20,Exhibition,Completed,"Art of the Fantastic: Latin America 1920 - 1987","Krannert Pavilion",1987-06-28,1987-09-13,"",Internal,"","","",
2443,EX1987.21,Exhibition,Completed,"The Heroic Image: Equestrian Portraits in Art","Indianapolis Museum of Art at Columbus, Columbus, Indiana",1987-08-01,1987-09-27,"",Internal,"","","",
2444,EX1987.22,Exhibition,Completed,"Johanna Erickson: Rug Tapestry","Long Gallery",1987-08-04,1987-08-30,"",Internal,"","","",
2445,EX1987.23,Exhibition,Completed,"Char Sloan: Herb Wreaths and Needle Art and Roger Sloan: Wood Sculpture","Long Gallery",1987-09-01,1987-09-30,"",Internal,"","","",
2446,EX1987.24,Exhibition,Completed,"The Aura of Neo-Impressionism: The W.J. Holliday Collection","The Dixon Gallery and Gardens, Memphis, Tennessee",1987-09-15,1987-11-08,"",Internal,"","","",17302 | 14444 | 13231 | 33029 | 32532 | 
2447,EX1987.25,Exhibition,Completed,"The Photomontages of Scott Mutter","Beesley Gallery",1987-09-29,1988-02-07,"",Internal,"","","",
2448,EX1987.26,Exhibition,Completed,"The Figural Images of Theodore Robinson, American Impressionist","3rd Floor South Gallery",1987-10-06,1987-11-29,"",Internal,"","","",
2449,EX1987.27,Exhibition,Completed,"Marion N. Ham: Primitive Hooked Rugs","Long Gallery",1987-10-06,1987-10-31,"",Internal,"","","",
2450,EX1987.28,Exhibition,Completed,"Selections From *Radiance and Virtue: The R. Norris Shreve Collection of Chinese Jade","Indianapolis Museum of Art at Columbus, Columbus, Indiana",1987-10-10,1987-11-28,"",Internal,"","","",
2451,EX1987.29,Exhibition,Completed,"Art of the Fantastic Latin America 1920 - 1987","The Queens Museum, Flushing, New York",1987-10-10,1987-12-16,"",Internal,"","","",
2452,EX1987.30,Exhibition,Completed,"27th Annual Fall Collection of the Alliance Rental  Gallery","Alliance Rental Gallery",1987-10-16,1987-11-01,"",Internal,"","","",
2453,EX1987.31,Exhibition,Completed,"Jack Brubaker: Hand-Forged Iron","Long Gallery",1987-11-03,1987-11-29,"",Internal,"","","",
2454,EX1987.32,Exhibition,Completed,"Indiana Orchid Society Exhibition","Herron Hall",1987-11-14,1987-11-15,"",Internal,"","","",
2455,EX1987.33,Exhibition,Completed,"Western Photographics of Edward Curtis","Bank One, Indianapolis",1987-11-23,1988-05-05,"",Internal,"","","",
2456,EX1987.34,Exhibition,Completed,"Robert Kasnak: Furniture, Hand-Crafted in Wood","Long Gallery",1987-12-01,1987-12-31,"",Internal,"","","",
2457,EX1987.35,Exhibition,Completed,"Pictures and Tapestries for a Holiday Season","Fauvre Gallery",1987-12-01,1988-01-03,"",Internal,"","","",17164 | 
2458,EX1987.36,Exhibition,Completed,"Selections from *The Folk Tradition*","Indianapolis Museum of Art at Columbus, Columbus, Indiana",1987-12-05,1988-01-16,"",Internal,"","","",8543 | 19677 | 17425 | 
2459,EX1987.37,Exhibition,Completed,"Bent Wood and Metal Furniture: 1850-1946","3rd Floor Galleries, and Riverview",1987-12-15,1988-02-07,"",Internal,"","","",
2460,EX1987.38,Exhibition,Completed,"Christmas at the Lilly Pavilion","Lilly Pavilion",1987-12-18,1988-01-03,"",Internal,"","","",22484 | 17089 | 6001 | 28015 | 22269 | 
3893,EX1987.39,Exhibition,Completed,"Ice and Green Clouds:  Traditions in Chinese Celadon","Minneapolis Institute of Arts, Minneapolis, MN",1987-04-18,1987-06-14,"",Internal,"","","",
3894,EX1987.40,Exhibition,Completed,"The Aura of Neo-Impressionism: The W.J. Holliday Collection","The Chrysler Museum, Norfolk, Virginia",1987-06-26,1987-08-23,"",Internal,"","","",17302 | 14444 | 13231 | 33029 | 32532 | 
3895,EX1987.41,Exhibition,Completed,"Ice and Green Clouds:  Traditions in Chinese Celadon","Asia Society Galleries",1987-07-16,1987-09-06,"",Internal,"","","",
3896,EX1987.42,Exhibition,Completed,"Ice and Green Clouds:  Traditions in Chinese Celadon","Kimbell Art Museum, Fort Worth, TX",1987-10-18,1988-01-03,"",Internal,"","","",
2461,EX1988.1,Exhibition,Completed,"The Aura of Neo-Impressionism: The W.J. Holliday Collection","David and Alfred Smart, Chicago, Illinois",1988-01-14,1988-03-06,"",Internal,"","","",17302 | 14444 | 13231 | 33029 | 32532 | 
2462,EX1988.2,Exhibition,Completed,"Art of the Fantastic Latin America 1920-1987","Center for the Fine Arts, Miami, Florida",1988-01-15,1988-03-04,"",Internal,"","","",
2463,EX1988.3,Exhibition,Completed,"Postcard Series VII: Arts Indiana","Long Gallery",1988-01-16,1988-01-29,"",Internal,"","","",
2464,EX1988.4,Exhibition,Completed,"Joseph Cantor, Connoisseur","Fauvre Gallery",1988-02-02,1988-03-13,"closing date extended until 05/12/1988",Internal,"","","",29558 | 
2465,EX1988.5,Exhibition,Completed,"Dena Hawer - Jewelry: A Study of Form and Surface","Long Gallery",1988-02-02,1988-02-28,"",Internal,"","","",
2466,EX1988.6,Exhibition,Completed,"Discover Brass Rubbings","Indianapolis Museum of Art at Columbus, Columbus, Indiana",1988-02-06,1988-03-19,"",Internal,"","","",
2467,EX1988.7,Exhibition,Completed,"Willow Furniture, Hand-block Prints and Salt-glazed Pottery","Long Gallery",1988-03-01,1988-03-31,"",Internal,"","","",
2468,EX1988.8,Exhibition,Completed,"Symphony in Color","Beesley Gallery",1988-03-08,1988-04-17,"",Internal,"","","",
2469,EX1988.9,Exhibition,Completed,"The Photomontages of Scott Mutter","Indianapolis Museum of Art at Columbus, Columbus, Indiana",1988-03-26,1988-05-15,"",Internal,"","","",
2470,EX1988.10,Exhibition,Completed,"Peggy Ahlgren Stoneware","Long Gallery",1988-04-05,1988-04-30,"",Internal,"","","",
2471,EX1988.11,Exhibition,Completed,"Gold and Silver Treasures from the Thyssen-Bornemisza Collection","Fauvre Gallery",1988-04-12,1988-06-05,"",Internal,"","","",
2472,EX1988.12,Exhibition,Completed,"Photography and All That Jazz: Duncan P. Schiedt","Beesley Gallery",1988-04-19,1988-07-31,"",Internal,"","","",
2473,EX1988.13,Exhibition,Completed,"Kai Binford: Clothing from the Hill Tribe People of Thailand","Long Gallery",1988-05-03,1988-05-29,"",Internal,"","","",
2474,EX1988.14,Exhibition,Completed,"Bonsai Tree Society Annual Exhibition","Herron Hall",1988-05-14,1988-05-15,"",Internal,"","","",
2475,EX1988.15,Exhibition,Completed,"Recent Acquisition: Samuel Palmer","Krannert I, Herron Hall",1988-05-17,1988-07-17,"",Internal,"","","",
2476,EX1988.16,Exhibition,Completed,"Riley Illustrated","Indianapolis Museum of Art at Columbus, Columbus, Indiana",1988-05-21,1988-07-09,"",Internal,"","","",27319 | 
2477,EX1988.17,Exhibition,Completed,"The Aura of Neo-Impressionism: The W.J. Holliday Collection","Rijksmuseum Vincent Van Gogh, Amsterdam, Netherlands",1988-05-21,1988-08-28,"",Internal,"","","",
2478,EX1988.18,Exhibition,Completed,"Ice and Green Clouds:  Tradition of Chinese Celadon","The Art Institute, Chicago, IL",1988-02-04,1988-03-27,"",Internal,"","","",
2479,EX1988.19,Exhibition,Completed,"Ken and Kathleen Dalton - Coker Creek Crafts","Long Gallery",1988-06-01,1988-06-30,"",Internal,"","","",
2480,EX1988.20,Exhibition,Completed,"Master Etchers: Arms, Chamberlain and Geerlings","Bank One Gallery, Indianapolis, IN",1988-06-06,1989-04-21,"",Internal,"","","",
2481,EX1988.21,Exhibition,Completed,"Gauguin and His Circle in Brittany: The Prints of the Pont-Aven School","Noyes Gallery",1988-06-18,1988-07-31,"",Internal,"","","",
2482,EX1988.22,Exhibition,Completed,"Images of a Floating World","Krannert Pavilion",1988-06-18,1988-07-31,"",Internal,"","","",
2483,EX1988.23,Exhibition,Completed,"Anne Marie Kenny: Surface Design/Fiber","Long Gallery",1988-07-05,1988-07-31,"",Internal,"","","",
2484,EX1988.24,Exhibition,Completed,"Joseph Cantor, Connoisseur","Indianapolis Museum of Art at Columbus, Columbus, Indiana",1988-07-16,1988-09-10,"",Internal,"","","",29558 | 
2485,EX1988.25,Exhibition,Completed,"Recent Acquisition: Cecilia Beaux","Krannert I, Herron Hall",1988-07-19,1988-08-31,"",Internal,"","","",
2486,EX1988.26,Exhibition,Completed,"Peggy Hitchcock: Mixed Media","Long Gallery",1988-08-02,1988-08-31,"",Internal,"","","",
2487,EX1988.27,Exhibition,Completed,"Marguerite Brennan: Ceramic Forms","Long Gallery",1988-09-01,1988-09-30,"",Internal,"","","",
2488,EX1988.28,Exhibition,Completed,"Views From Jade Terrace: Chinese Women Artists, 1300-1912","Herron Hall",1988-09-03,1988-11-06,"",Internal,"","","",
2489,EX1988.29,Exhibition,Completed,"Transforming the American Garden: 12 New Landscape Designs","Indianapolis Museum of Art at Columbus, Columbus, Indiana",1988-09-17,1988-11-05,"",Internal,"","","",
2490,EX1988.30,Exhibition,Completed,"Recent Acquisition: Celadon Cup","Krannert I, Herron Hall",1988-09-20,1988-11-20,"",Internal,"","","",
2491,EX1988.31,Exhibition,Completed,"Where We Live (Indiana Experience Symposium)","Clowes, DeBoest Lecture Hall",1988-09-30,1988-10-01,"",Internal,"","","",
2492,EX1988.32,Exhibition,Completed,"Doris Louie: Tapestry Weaving","Long Gallery",1988-10-04,1988-10-30,"",Internal,"","","",
2493,EX1988.33,Exhibition,Completed,"28th Annual Fall Collection of the Alliance Rental & Sales Gallery","Alliance Rental Gallery",1988-10-14,1988-10-30,"",Internal,"","","",
2494,EX1988.34,Exhibition,Completed,"Symposium for Views from Jade Terrace: Chinese Women Artists, 1300-1912","Clowes, DeBoest Lecture Hall",1988-10-14,1988-10-15,"",Internal,"","","",
2495,EX1988.35,Exhibition,Completed,"Richard Jolley and Tommy Rush: Blown Glass & Sculpture","Long Gallery",1988-11-01,1988-11-30,"",Internal,"","","",
2496,EX1988.36,Exhibition,Completed,"Indiana Orchid Society Exhibition","Herron Hall",1988-11-05,1988-11-06,"",Internal,"","","",
2497,EX1988.37,Exhibition,Completed,"The Miller Creche Collection","Indianapolis Museum of Art at Columbus, Columbus, Indiana",1988-11-19,1989-01-08,"",Internal,"","","",
2498,EX1988.38,Exhibition,Completed,"Recent Acquisition: Peruvian Textile","Krannert I, Herron Hall",1988-11-22,1989-01-22,"",Internal,"","","",
2499,EX1988.39,Exhibition,Completed,"Dickens","Fauvre Gallery",1988-12-01,1989-01-01,"",Internal,"","","",
2500,EX1988.40,Exhibition,Completed,"Douglas Noren: Shaker Furniture","Long Gallery",1988-12-01,1988-12-31,"",Internal,"","","",
2501,EX1988.41,Exhibition,Completed,"Pictures for the Holiday Season","Krannert I, Fauvre Gallery",1988-12-01,1989-01-01,"",Internal,"","","",
2502,EX1988.42,Exhibition,Completed,"The Face of Ancient America: The Wally and Brenda Zollman Collection of Pre-Columbian Art","Noyes Gallery",1988-12-03,1989-02-26,"",Internal,"","","",63120 | 
2503,EX1988.43,Exhibition,Completed,"Christmas at the Lilly Pavilion","Lilly Pavilion",1988-12-16,1988-12-31,"",Internal,"","","",
2504,EX1988.44,Exhibition,Completed,"Views from Jade Terrace: Chinese Women Artists 1300-1912","Virginia Museum of Fine Arts, Richmond, Virginia",1988-12-05,1989-01-15,"",Internal,"","","",
2505,EX1989.1,Exhibition,Completed,"Recent Acquisition: Peruvian Textile","Krannert I, Herron Hall",1989-01-03,1989-01-22,"",Internal,"","","",
2506,EX1989.2,Exhibition,Completed,"Arts Insight Postcard Series VIII: Arts Indiana Cover Exhibition, Sept '87 - June '88.","Long Gallery",1989-01-04,1989-01-31,"",Internal,"","","",
2507,EX1989.3,Exhibition,Completed,"Is It Genuine? Steele, Forsyth and Forgery in Indiana","Fauvre Gallery",1989-01-10,1989-03-19,"",Internal,"","","",
2508,EX1989.4,Exhibition,Completed,"Recent Acquisition: Von Wiegand","Krannert I, Herron Hall",1989-01-24,1989-03-26,"",Internal,"","","",
2509,EX1989.5,Exhibition,Completed,"Photography and All That Jazz: Duncan P. Schiedt","Indianapolis Museum of Art at Columbus, Columbus, Indiana",1989-01-28,1989-03-25,"",Internal,"","","",
2510,EX1989.6,Exhibition,Completed,"Anneke Herrold: Fibers","Long Gallery",1989-02-01,1989-02-26,"",Internal,"","","",
2511,EX1989.7,Exhibition,Completed,"Views from Jade Terrace: Chinese Women Artists, 1300-1912","Asian Art Museum of San Francisco, San Francisco, California",1989-02-13,1989-04-02,"",Internal,"","","",
2512,EX1989.8,Exhibition,Completed,"Cindy Nishimura: Baskets","Long Gallery",1989-03-01,1989-03-31,"",Internal,"","","",
2513,EX1989.9,Exhibition,Completed,"Views of Rome: Watercolors and Drawings from the Collection of the Biblioteca Apostolico Vaticana","Noyes Gallery",1989-03-18,1989-06-04,"",Internal,"","","",
2514,EX1989.10,Exhibition,Completed,"The Aura of Neo-Impressionism: The W.J. Holliday Collection","The Phoenix Art Museum, Phoenix, Arizona",1989-03-18,1989-05-28,"",Internal,"","","",61 | 
2515,EX1989.11,Exhibition,Completed,"Symphony in Color","Beesley Gallery",1989-03-21,1989-04-16,"",Internal,"","","",
2516,EX1989.12,Exhibition,Completed,"Recent Acquisitions: Moninckx","Krannert I, Herron Hall",1989-03-28,1989-05-21,"",Internal,"","","",
2517,EX1989.13,Exhibition,Completed,"Artists in Education: Selections by Bartholomew County Art Teachers","Indianapolis Museum of Art at Columbus, Columbus, Indiana",1989-03-31,1989-05-26,"",Internal,"","","",
2518,EX1989.14,Exhibition,Completed,"Is It Genuine? Steele, Forsyth and Forgery in Indiana","Indianapolis Museum of Art at Columbus, Columbus, Indiana",1989-04-01,1989-05-21,"",Internal,"","","",
2519,EX1989.15,Exhibition,Completed,"Candace Lorimer: Fashion Designer","Long Gallery",1989-04-04,1989-04-30,"",Internal,"","","",
2520,EX1989.16,Exhibition,Completed,"Robert Irwin Disk","Krannert I, Fauvre Gallery",1989-04-25,1989-06-06,"",Internal,"","","",
2521,EX1989.17,Exhibition,Completed,"Chris Roberts-Antique: Fibers","Long Gallery",1989-05-02,1989-05-31,"",Internal,"","","",
2522,EX1989.18,Exhibition,Completed,"Bonsai Tree Society Annual Exhibition","Herron Hall",1989-05-06,1989-05-07,"",Internal,"","","",
2523,EX1989.19,Exhibition,Completed,"Recent Acquisition: Martele Pitcher","Krannert I, Herron Hall",1989-05-23,1989-07-23,"",Internal,"","","",
2524,EX1989.20,Exhibition,Completed,"Dines Carlsen: Self-portraits (1901 - 1966)","Indianapolis Museum of Art at Columbus, Columbus, Indiana",1989-05-27,1989-07-16,"",Internal,"","","",
2525,EX1989.21,Exhibition,Completed,"Janet Starkey: Ceramics","Long Gallery",1989-06-01,1989-06-30,"",Internal,"","","",
2526,EX1989.22,Exhibition,Completed,"Lilly Fest","Bank One Gallery",1989-06-11,,"",Internal,"","","",
2527,EX1989.23,Exhibition,Completed,"Views from Jade Terrace: Chinese Women Artists, 1300-1912","Hong Kong Museum of Art, Hong Kong",1989-06-29,1989-08-27,"",Internal,"","","",
2528,EX1989.24,Exhibition,Completed,"More Than Red, White and Blue: American Paintings from the Collection","Noyes Gallery",1989-07-02,1989-08-20,"",Internal,"","Ellen Lee","Sherman O'Hara",34669 | 13698 | 15247 | 31985 | 21288 | 14594 | 29147 | 17602 | 21781 | 34467 | 8732 | 33154 | 14446 | 28629 | 10877 | 25805 | 19889 | 22671 | 25715 | 34170 | 15784 | 18168 | 24797 | 19666 | 27999 | 22391 | 4509 | 30477 | 18670 | 36078 | 27818 | 13567 | 12362 | 
2529,EX1989.25,Exhibition,Completed,"Symbols of Significance: Motifs in Chinese Art","Indianapolis Museum of Art at Columbus, Columbus, Indiana",1989-07-22,1989-09-16,"",Internal,"","","",25220 | 8199 | 
2530,EX1989.26,Exhibition,Completed,"Recent Acquisition: Maratta","Krannert I, Herron Hall",1989-07-25,1989-09-17,"",Internal,"","","",
2531,EX1989.27,Exhibition,Completed,"African Improvisation: Textiles from the Collection","Noyes Gallery",1989-09-02,1990-02-11,"",Internal,"","","",33566 | 27801 | 
2532,EX1989.28,Exhibition,Completed,"Ancient Art of the North American Woodland Indians","Indianapolis Museum of Art at Columbus, Columbus, Indiana",1989-09-23,1989-11-11,"",Internal,"","","",29916 | 31759 | 
2533,EX1989.29,Exhibition,Completed,"The Aura of Neo-Impressionism: The W.J. Holliday Collection","Milwaukee Art Museum, Milwaukee, Wisconsin",1989-09-15,1989-11-05,"",Internal,"","","",
2534,EX1989.30,Exhibition,Completed,"Recent Acquisition: BWA People","Krannert I, Herron Hall",1989-09-19,1990-02-12,"",Internal,"","","",
2535,EX1989.31,Exhibition,Completed,"Alden Smith Presents Latin and Haitian Folkart","Long Gallery",1989-11-01,1989-12-03,"",Internal,"","","",
2536,EX1989.32,Exhibition,Completed,"American and European Art: Pottery From the IMA - 1880-1950","Indianapolis Museum of Art at Columbus, Columbus, Indiana",1989-11-18,1990-01-06,"",Internal,"","","",
2537,EX1989.33,Exhibition,Completed,"Who'd A Thought It, Improvisation African-American Quiltmaking","Krannert I, South Gallery",1989-12-01,1990-01-28,"",Internal,"","","",
2538,EX1989.34,Exhibition,Completed,"Christmas at the Lilly Pavilion","Lilly Pavilion",1989-12-15,1989-12-31,"",Internal,"","","",
3919,EX1989.35,Exhibition,Completed,"Views from the Jade Terrace:  Chines Women Artists, 1300 - 1912","National Museum of Women in the Arts, Washington, D.C.",1989-04-24,1989-06-04,"",Internal,"","","",
3920,EX1989.36,Exhibition,Completed,"Views from the Jade Terrace:  Chinese Women Artists, 1300 - 1912","China House Gallery, New York, NY",1989-10-05,1989-12-02,"",Internal,"","","",
2539,EX1990.1,Exhibition,Completed,"Indiana Artists Postcard Series IX: Arts Indiana Cover Exhibition","Long Gallery",1990-01-03,1990-01-31,"",Internal,"","","",
2540,EX1990.2,Exhibition,Completed,"Artists Who Are Women: Selection of Work from the '80s in the Collection of the IMA","Indianapolis Museum of Art at Columbus, Columbus, Indiana",1990-01-27,1990-03-24,"",Internal,"","","",
2541,EX1990.3,Exhibition,Completed,"Jim Kemp: Ceramics","Long Gallery",1990-02-06,1990-02-28,"",Internal,"","","",
2542,EX1990.4,Exhibition,Completed,"Recent Acquisition: Huchthausen","Krannert I",1990-02-12,1990-03-12,"",Internal,"","","",
2543,EX1990.5,Exhibition,Completed,"Jerome Joseph & Lorna Secrest: Works of Wood","Long Gallery",1990-03-06,1990-03-31,"",Internal,"","","",
2544,EX1990.6,Exhibition,Completed,"Recent Acquisition: Moninckx","Krannert I",1990-03-13,1990-05-01,"",Internal,"","","",
2545,EX1990.7,Exhibition,Completed,"Symphony in Color","Peat Gallery",1990-03-27,1990-04-15,"",Internal,"","","",
2546,EX1990.8,Exhibition,Completed,"Artists in Education: Selections by Bartholomew County Art Teachers 1990","Indianapolis Museum of Art at Columbus, Columbus, Indiana",1990-03-31,1990-05-26,"",Internal,"","","",
2547,EX1990.9,Exhibition,Completed,"Kimberly Haldeman Klein: Amish Pillows and Wallhangings and Darlene Fitz: Baskets","Long Gallery",1990-04-03,1990-04-29,"",Internal,"","","",
2548,EX1990.10,Exhibition,Completed,"Darlene Fritz: Baskets","Krannert, Long Gallery",1990-04-03,1990-04-29,"",Internal,"","","",
2549,EX1990.11,Exhibition,Completed,"Liz Galbraith: Handmade Paper Shades & Lamps","Long Gallery",1990-05-01,1990-05-31,"",Internal,"","","",
2550,EX1990.12,Exhibition,Completed,"Beyond Black and White: Chiaroscura Prints from Indiana Collections","Clowes Pavilion",1990-05-01,1990-07-01,"",Internal,"","","",
2551,EX1990.13,Exhibition,Completed,"Precolumbiam Gallery K201 Opening","",1990-06-01,1990-07-01,"",Internal,"","","",
2552,EX1990.14,Exhibition,Completed,"African Improvisation: Textiles from the Collection","Indianapolis Museum of Art at Columbus, Columbus, Indiana",1990-06-02,1990-07-21,"",Internal,"","","",33566 | 27801 | 
2553,EX1990.15,Exhibition,Completed,"Richard Burkett: Recent Ceramics","Long Gallery",1990-06-05,1990-06-30,"",Internal,"","","",
2554,EX1990.16,Exhibition,Completed,"Black and White: Prints of the American Scene","",1990-07-10,1990-09-16,"",Internal,"","","",32992 | 17758 | 28189 | 
2555,EX1990.17,Exhibition,Completed,"Eliel Saarinen, Finnish American Architect, 1878-1950","Indianapolis Museum of Art at Columbus, Columbus, Indiana",1990-07-28,1990-11-10,"",Internal,"","","",
2556,EX1990.18,Exhibition,Completed,"Tampopo Presents: Contemporary and Traditional Japanese Crafts","Long Gallery",1990-08-02,1990-08-31,"",Internal,"","","",
2557,EX1990.19,Exhibition,Completed,"Ethnographic Crafts from Africa","Long Gallery",1990-09-04,1990-09-30,"",Internal,"","","",
2558,EX1990.20,Exhibition,Completed,"Sol Lewitt Mural Installation","Krannert Parking & Karnnert I, Grand Staircase",1990-09-04,1990-09-28,"",Internal,"","","",24777 | 
2559,EX1990.21,Exhibition,Completed,"The Premiere of the Asian Galleries","Krannert II, Asian Galleries",1990-09-24,,"",Internal,"","","",
2560,EX1990.22,Exhibition,Completed,"Dorothy Feibleman Ceramics","Long Gallery",1990-10-02,1990-10-31,"",Internal,"","","",
2561,EX1990.23,Exhibition,Completed,"Richard Pousette-Dart: A Retrospective","Allen Whitehill Clowes Special Exhibition Gallery",1990-10-14,1990-12-30,"",Internal,"","","",36991 | 30301 | 
2562,EX1990.24,Exhibition,Completed,"Opening of the Eiteljorg Collection of African Art -- Permanent Collection","Hulman Hall",1990-10-13,,"",Internal,"","","",
2563,EX1990.25,Exhibition,Completed,"African Household Arts","Eiteljorg Gallery",1990-10-14,1991-07-14,"",Internal,"","","",
2564,EX1990.26,Exhibition,Completed,"Seurat at Gravelines: The Last Landscapes","Forefront Gallery",1990-10-14,1990-11-25,"",Internal,"","","",16196 | 
2565,EX1990.27,Exhibition,Completed,"Richard Pousette-Dart: Drawings","Clowes II, Prints and Drawings Galleries",1990-10-14,1991-03-03,"",Internal,"","","",
2566,EX1990.28,Exhibition,Completed,"Molly Morojan Phinny and Joanne Evans: One of a Kind Cottage Furniture","Long Gallery",1990-11-01,1990-11-30,"",Internal,"","","",
2567,EX1990.29,Exhibition,Completed,"The Passage: Return of Indiana Painters from Germany - 1880-1905","Wallraf-Richardtz Cologne and IMA",1990-11-14,1991-01-27,"",Internal,"","","",29270 | 16502 | 18672 | 17123 | 37087 | 37383 | 91744 | 95907 | 
2568,EX1990.30,Exhibition,Completed,"30th Annual Fall Show of the Alliance Rental Gallery","Alliance Rental Gallery",1990-11-16,1990-12-02,"",Internal,"","","",
2569,EX1990.31,Exhibition,Completed,"Indiana Orchid Society Exhibition","Herron Hall",1990-11-17,1990-11-18,"",Internal,"","","",
2570,EX1990.32,Exhibition,Completed,"America as Pictured by Currier and Ives","Indianapolis Museum of Art at Columbus, Columbus, Indiana",1990-11-24,1991-01-05,"",Internal,"","","",
2571,EX1990.33,Exhibition,Completed,"James P. Holmes & Deborah L. Doane: Blown Glass","Long Gallery",1990-12-04,1990-12-31,"",Internal,"","","",
2572,EX1990.34,Exhibition,Completed,"Holiday at the Lilly Pavilion","Lilly Pavilion",1990-12-14,1990-12-30,"",Internal,"","","",
2573,EX1991.1,Exhibition,Completed,"Arts Indiana Postcard Series X: and Cover Exhibition","Long Gallery",1991-01-07,1991-01-28,"",Internal,"","","",
2574,EX1991.2,Exhibition,Completed,"Amish Quilts from the Collection of the Indianapolis Museum of Art and the Indiana State Museum","Indianapolis Museum of Art at Columbus, Columbus, Indiana",1991-01-26,1991-03-30,"",Internal,"","","",8407 | 
2575,EX1991.3,Exhibition,Completed,"Who'd a Thought it: Improvisation in African-American Quiltmaking","Special Exhibition Gallery",1991-02-01,1991-03-17,"",Internal,"","","",
2576,EX1991.4,Exhibition,Completed,"Xenobia Bailey: Headgear with African Influence","Long Gallery",1991-02-02,1991-02-28,"",Internal,"","","",
2577,EX1991.5,Exhibition,Completed,"Richard Pousette-Dart: A Retrospective","Detroit Institute of Art, Detroit, Michigan",1991-02-08,1991-04-07,"",Internal,"","","",
2578,EX1991.6,Exhibition,Completed,"The Passage:Return of Indiana Painters from Germany 1880-1905","Landesmuseum, Mainz, Germany",1991-02-24,1991-05-19,"",Internal,"","","",16502 | 18672 | 29270 | 37087 | 37383 | 91744 | 95907 | 
2579,EX1991.7,Exhibition,Completed,"Art Objects from the Fabric Workshop Artist Residency Program","Long Gallery",1991-03-05,1991-03-31,"",Internal,"","","",
2580,EX1991.8,Exhibition,Completed,"Symphony in Color","Clowes Pavilion",1991-03-12,1991-04-18,"",Internal,"","","",
2581,EX1991.9,Exhibition,Completed,"In Indiana: Peg Fierke","Krannert III, In Indiana gallery",1991-03-15,1991-04-28,"",Internal,"","","",
2582,EX1991.10,Exhibition,Completed,"Edvard Munch: Master Prints from the Epstein Family Collection","Special Exhibition Gallery",1991-03-23,1991-05-05,"",Internal,"","","",
2583,EX1991.11,Exhibition,Completed,"Marie Webster Quilts: A Retrospective (Extended through 10/13/91)","Paul Textile Arts Gallery",1991-03-24,1991-09-30,"",Internal,"","","",18707 | 23275 | 29513 | 10578 | 5966 | 8524 | 24363 | 19329 | 68421 | 13652 | 27130 | 9830 | 35735 | 17983 | 11717 | 2352 | 30132 | 26954 | 18353 | 
2584,EX1991.12,Exhibition,Completed,"Dark Ages: Natural Phenomena and the Poetics of Science","Forefront Gallery",1991-03-24,1991-06-16,"",Internal,"","","",
